,title,url,topic,compound_sentiment,textblob_polarity
1202,Hospital Megasystems: More Expensive and No Improvement in Care,https://www.reddit.com/r/medicine/comments/eqzqvw/hospital_megasystems_more_expensive_and_no/,,0.9888,0.1641709079209079
302,"As of today, my states health department is averaging ELEVEN days to report COVID swab results to our clinic and patients. Please tell me we are an outlier.",https://www.reddit.com/r/medicine/comments/fv0ch9/as_of_today_my_states_health_department_is/,Medical Studies,-0.5803,0.033540669856459336
1014,Routine testing of healthcare workers,https://www.reddit.com/r/medicine/comments/hns78k/routine_testing_of_healthcare_workers/,Medical Studies,-0.7449,0.15446428571428572
1235,Rape charges against high profile LA orthopedic surgeon dismissed,https://www.reddit.com/r/medicine/comments/eza3h1/rape_charges_against_high_profile_la_orthopedic/,,-0.7783,0.16
1104,Chest tube instructional video - Behind the Knife,https://www.reddit.com/r/medicine/comments/hx4apq/chest_tube_instructional_video_behind_the_knife/,Medical Studies,0.848,0.06777777777777777
