,title,url,topic,compound_sentiment,textblob_polarity
840,Do you think any permanent changes will happen in the way we practice medicine in the post CoVid world ?,https://www.reddit.com/r/medicine/comments/haiaiq/do_you_think_any_permanent_changes_will_happen_in/,Medical Studies,0.9596,0.014414414414414408
537,PPE guidelines around the world - any help?,https://www.reddit.com/r/medicine/comments/gd9f20/ppe_guidelines_around_the_world_any_help/,Coronavirus Treatment,0.9628,0.14593554593554592
237,Introducing r/physicians: a private subreddit for physicians,https://www.reddit.com/r/medicine/comments/fvi3v0/introducing_rphysicians_a_private_subreddit_for/,Medical Studies,0.9682,0.16645454545454544
615,Need a Breakdown This,https://www.reddit.com/r/medicine/comments/gtypvq/need_a_breakdown_this/,Coronavirus Treatment,-0.4859,-0.002777777777777777
798,"Dr. David Wolfe (Indiana U) gives a lot of context to the George Floyd Court Records (erroneously called an ""Autopsy Report"") circulating in the news media",https://www.reddit.com/r/medicine/comments/guyrr6/dr_david_wolfe_indiana_u_gives_a_lot_of_context/,,0.0,-0.5
1331,Handheld US is hot right now. Whats the best one?,https://www.reddit.com/r/medicine/comments/f6g4vo/handheld_us_is_hot_right_now_whats_the_best_one/,Medical Studies,0.8708,0.12890211640211638
441,NPs like the author of this article need to stop claiming that they have medical knowledge equivalent to MD/DOs!,https://www.reddit.com/r/medicine/comments/gfxdyi/nps_like_the_author_of_this_article_need_to_stop/,Coronavirus Precautions,0.4199,0.125
103,"I aint no rocket surgeon, but...",https://www.reddit.com/r/medicine/comments/fgu6io/i_aint_no_rocket_surgeon_but/,Coronavirus Treatment,-0.5132,0.2714285714285714
510,New Jersey EMS services are withholding CPR for most patients,https://www.reddit.com/r/medicine/comments/ghdx44/new_jersey_ems_services_are_withholding_cpr_for/,Healthcare System,0.8862,0.176489898989899
73,How to avoid malpractice lawsuits as a resident?,https://www.reddit.com/r/medicine/comments/f1igul/how_to_avoid_malpractice_lawsuits_as_a_resident/,Medical Studies,0.7213,0.15666666666666668
668,"TIL about the “Doctor Draft”, where health professionals between age 18-44 can be conscripted by Selective Services",https://www.reddit.com/r/medicine/comments/ek5037/til_about_the_doctor_draft_where_health/,,0.0,0.0
756,Practices misused/overused/underused in the acute setting?,https://www.reddit.com/r/medicine/comments/f8xthd/practices_misusedoverusedunderused_in_the_acute/,Coronavirus Treatment,0.1506,0.3527777777777778
681,"The ""medicalization"" of intermittent fasting as a clinical intervention for aging-related diseases. How much more data would you need to prescribe this to your patients with DM? With CV disease? With neurodegenerative disease?",https://www.reddit.com/r/medicine/comments/ejpsr3/the_medicalization_of_intermittent_fasting_as_a/,Coronavirus Treatment,0.0,0.5
164,Medical worker describes terrifying lung failure from COVID-19 even in his young patients,https://www.reddit.com/r/medicine/comments/fme6au/medical_worker_describes_terrifying_lung_failure/,Coronavirus Treatment,-0.7906,-0.30416666666666664
1344,The Private Equity Takeover - Can we stop it? Should we?,https://www.reddit.com/r/medicine/comments/f663j7/the_private_equity_takeover_can_we_stop_it_should/,,0.4098,0.0
812,How do I deal with a family member telling me test results that are very worrying?,https://www.reddit.com/r/medicine/comments/gz7q6h/how_do_i_deal_with_a_family_member_telling_me/,Medical Studies,-0.4005,0.2
233,Living standards of doctors in different places,https://www.reddit.com/r/medicine/comments/g1rr0z/living_standards_of_doctors_in_different_places/,Medical Studies,-0.8178,0.024677033492822954
347,Gallop Poll released today. 10% of Americans believe vaccines cause autism. 46% unsure,https://www.reddit.com/r/medicine/comments/epo1e8/gallop_poll_released_today_10_of_americans/,School & Training,-0.25,0.0
1073,Survival potential will determine whether South Texas county hospital takes in COVID-19 patients,https://www.reddit.com/r/medicine/comments/hx860w/survival_potential_will_determine_whether_south/,Medical Studies,0.0,0.0
951,The Independent: Trump again claims coronavirus is ‘going to just disappear’ as US sees record number of new cases,https://www.reddit.com/r/medicine/comments/hjlghs/the_independent_trump_again_claims_coronavirus_is/,Coronavirus Precautions,0.0772,0.06818181818181818
848,A good death in the ICU,https://www.reddit.com/r/medicine/comments/hg243v/a_good_death_in_the_icu/,Healthcare System,-0.9898,0.06190270047412905
988,WHO confirms theres emerging evidence of airborne transmission of coronavirus,https://www.reddit.com/r/medicine/comments/hnehcl/who_confirms_theres_emerging_evidence_of_airborne/,Coronavirus Treatment,0.0,0.0
581,To my ED or perhaps Psych colleagues: Has anyone ever actually seen or used the proverbial haldol dart?,https://www.reddit.com/r/medicine/comments/glsg0a/to_my_ed_or_perhaps_psych_colleagues_has_anyone/,Healthcare System,0.7287,0.16223958333333333
1012,"Effect of Hydroxychloroquine in Hospitalized Patients with COVID-19: Preliminary results from a multi-centre, randomized, controlled trial.",https://www.reddit.com/r/medicine/comments/hru2nn/effect_of_hydroxychloroquine_in_hospitalized/,Coronavirus Treatment,0.0,0.0
634,Just the facts: How to assess a patient with constant vertigo and nystagmus in the emergency department,https://www.reddit.com/r/medicine/comments/grhbnr/just_the_facts_how_to_assess_a_patient_with/,Medical Studies,-0.3818,0.0
242,Someone stole most of the N95s from our ER,https://www.reddit.com/r/medicine/comments/fsq6vh/someone_stole_most_of_the_n95s_from_our_er/,Medical Studies,-0.9605,-0.022222222222222227
106,How long has COVID19 been spreading in the US,https://www.reddit.com/r/medicine/comments/fijmcr/how_long_has_covid19_been_spreading_in_the_us/,Healthcare System,0.0,0.12333333333333334
774,Physician Assisted Suicide - for Chronic Fatigue Syndrome?!,https://www.reddit.com/r/medicine/comments/gzc388/physician_assisted_suicide_for_chronic_fatigue/,Coronavirus Treatment,-0.7777,0.0
352,"159,000 large physician group endorses medicare for all",https://www.reddit.com/r/medicine/comments/ertp4i/159000_large_physician_group_endorses_medicare/,Medical Studies,0.34,0.21428571428571427
1057,"Study (n=480) finds that recent and soon to be graduating vascular surgery trainees with an identifiable social media account (n=235), 25% contained unprofessional content. #Medbikini is now trending on Twitter.",https://www.reddit.com/r/medicine/comments/hx0rnl/study_n480_finds_that_recent_and_soon_to_be/,Medical Studies,-0.5106,0.044444444444444446
1131,Chewing gum before surgey.,https://www.reddit.com/r/medicine/comments/ht7x0v/chewing_gum_before_surgey/,Medical Studies,0.8481,0.044444444444444446
1216,Potential source identified for novel Coronavirus,https://www.reddit.com/r/medicine/comments/eth3al/potential_source_identified_for_novel_coronavirus/,Coronavirus Treatment,0.3182,0.0
1053,"Journal Club - Neurological and neuropsychiatric complications of COVID-19 in 153 patients (Lancet, JUN2020; posted originally in r/psychiatry but applicable to all)",https://www.reddit.com/r/medicine/comments/hovscd/journal_club_neurological_and_neuropsychiatric/,Medical Studies,0.0,0.375
1005,Which specialties leadership and professional organizations do a good job of advocating for their fields success? Which ones dont?,https://www.reddit.com/r/medicine/comments/hr7y7t/which_specialties_leadership_and_professional/,Coronavirus Precautions,0.2382,0.27499999999999997
643,Covid19 and medical communitys self righteousness,https://www.reddit.com/r/medicine/comments/gqmqtb/covid19_and_medical_communitys_self_righteousness/,Medical Studies,-0.8046,-0.058333333333333334
938,"If M4A becomes reality, how do you believe the proposed ~20% reduction in physician reimbursement will affect current physicians and those interested in entering the field?",https://www.reddit.com/r/medicine/comments/f5j2t9/if_m4a_becomes_reality_how_do_you_believe_the/,,0.4306,0.02904040404040404
741,"Unprecedented Drop in US Cancer Deaths, Driven by Lung Cancer",https://www.reddit.com/r/medicine/comments/emvnak/unprecedented_drop_in_us_cancer_deaths_driven_by/,,-0.8979,0.6
968,How are DOs that spread misinformation like Dr Rashid Buttar on social media allowed to keep their licenses?,https://www.reddit.com/r/medicine/comments/hmshmg/how_are_dos_that_spread_misinformation_like_dr/,Medical Studies,-0.4696,0.06333333333333331
622,Endovascular Thrombectomy with or without Intravenous Alteplase in Acute Stroke,https://www.reddit.com/r/medicine/comments/gs6c4n/endovascular_thrombectomy_with_or_without/,Coronavirus Precautions,0.0,0.6
1147,Recommended tools to brush up on hospital medicine?,https://www.reddit.com/r/medicine/comments/hum1u4/recommended_tools_to_brush_up_on_hospital_medicine/,Medical Studies,0.9199,0.44227272727272726
737,Anyone ever thought about leaving medicine (giving up?) Does it get better?,https://www.reddit.com/r/medicine/comments/eo2y60/anyone_ever_thought_about_leaving_medicine_giving/,Medical Studies,0.8965,0.15075757575757576
808,Combat Racial Injustice in Medicine With the PrIMES Program!,https://www.reddit.com/r/medicine/comments/gyzdsq/combat_racial_injustice_in_medicine_with_the/,Coronavirus Precautions,0.9572,0.18437194525904205
591,"PA with an online Doctorate degree in Medical Science studies provided an interview with a local news station as a ""medical student"" that recently graduated as a ""doctor"", but never mentioned that he was a PA.",https://www.reddit.com/r/medicine/comments/gmh2so/pa_with_an_online_doctorate_degree_in_medical/,Coronavirus Precautions,0.0,0.0
1160,Vocera,https://www.reddit.com/r/medicine/comments/es2cfz/vocera/,Coronavirus Treatment,0.7131,0.2
426,Topicalisation for COVID-19 swabs?,https://www.reddit.com/r/medicine/comments/g6ijpa/topicalisation_for_covid19_swabs/,Coronavirus Treatment,-0.2467,-0.05595238095238094
186,"SARS-CoV-2 Cell Entry Depends on ACE2 and TMPRSS2 and Is Blocked by a Clinically Proven Protease Inhibitor: Camostat mesylate, an inhibitor of TMPRSS2, blocks SARS-CoV-2 infection of lung cells.",https://www.reddit.com/r/medicine/comments/fjsvrk/sarscov2_cell_entry_depends_on_ace2_and_tmprss2/,Healthcare System,-0.5574,0.0
4,"[Serious] What is your plan if you or someone in your family get sick, regarding COVID-19",https://www.reddit.com/r/medicine/comments/fdznn0/serious_what_is_your_plan_if_you_or_someone_in/,Medical Studies,-0.9434,0.07491801128164764
544,"Whats the deal with IUDs, America?",https://www.reddit.com/r/medicine/comments/gds0pi/whats_the_deal_with_iuds_america/,Medical Studies,-0.86,0.03068181818181819
452,WSU faculty physicians get pay cut as medical school tuition rises,https://www.reddit.com/r/medicine/comments/gdzghi/wsu_faculty_physicians_get_pay_cut_as_medical/,,-0.3612,0.0
24,"Trauma Surgeon redesigns the standard car jack, inspired by unnecessary deaths and injuries he witnessed as a med student.",https://www.reddit.com/r/medicine/comments/fbvz6p/trauma_surgeon_redesigns_the_standard_car_jack/,,0.1027,-0.2
23,Why have an epidural when you can enjoy a natural child birth.,https://www.reddit.com/r/medicine/comments/fduzgn/why_have_an_epidural_when_you_can_enjoy_a_natural/,Medical Studies,0.6908,0.25
613,What is your specialty/practice model and how many hours do you typically work per week?,https://www.reddit.com/r/medicine/comments/gpa2e6/what_is_your_specialtypractice_model_and_how_many/,Medical Studies,0.0,0.11111111111111112
678,"Attending physicians, what have you learned or regretted about money? Those who have financial advisors, how were they of help?",https://www.reddit.com/r/medicine/comments/eorm4d/attending_physicians_what_have_you_learned_or/,Medical Studies,0.1179,0.0
690,Question to our forensic pathology colleagues: How difficult is it to figure out cause of death?,https://www.reddit.com/r/medicine/comments/guu4yc/question_to_our_forensic_pathology_colleagues_how/,Coronavirus Precautions,-0.9773,-0.12197802197802199
791,Metformin 500mg ER recall due to NMDA contamination. I hope it doesn’t “go ranitidine” and get found in all lots of all forms.,https://www.reddit.com/r/medicine/comments/guvp0i/metformin_500mg_er_recall_due_to_nmda/,Healthcare System,0.4404,-0.125
1336,"Discussion: ideally, what do you think should happen to those who spread pseudoscience?",https://www.reddit.com/r/medicine/comments/f806tf/discussion_ideally_what_do_you_think_should/,Medical Studies,-0.9053,0.1125
976,ACOG Statement on New Florida Law Requiring Written Consent for Pelvic Examinations,https://www.reddit.com/r/medicine/comments/hkwmpf/acog_statement_on_new_florida_law_requiring/,Coronavirus Precautions,0.2263,0.13636363636363635
428,Epic EMR tricks compilation,https://www.reddit.com/r/medicine/comments/g55d2d/epic_emr_tricks_compilation/,Coronavirus Treatment,0.6322,0.19499999999999998
445,Female physicians married to non-physicians- how do you and your partner split home/child chores?,https://www.reddit.com/r/medicine/comments/gkp9cl/female_physicians_married_to_nonphysicians_how_do/,Medical Studies,0.8862,0.24573934837092734
409,Potential Need for a Modern Version of the Flexner Report,https://www.reddit.com/r/medicine/comments/g429en/potential_need_for_a_modern_version_of_the/,Coronavirus Precautions,0.9786,0.12256944444444445
256,An ER doctor dies in his husbands arms a week after first coronavirus symptoms,https://www.reddit.com/r/medicine/comments/ftmcsr/an_er_doctor_dies_in_his_husbands_arms_a_week/,Medical Studies,0.0,0.25
944,The ECG on hospital presentation predicts death in COVID-19,https://www.reddit.com/r/medicine/comments/hcr5c3/the_ecg_on_hospital_presentation_predicts_death/,Medical Studies,-0.5994,0.0
704,Tramadol isnt the devil - change my mind!,https://www.reddit.com/r/medicine/comments/en2cvm/tramadol_isnt_the_devil_change_my_mind/,Healthcare System,-0.9979,-0.18263888888888888
1115,What long term effects of COVID have you seen in younger populations?,https://www.reddit.com/r/medicine/comments/htmrw5/what_long_term_effects_of_covid_have_you_seen_in/,Coronavirus Treatment,0.5424,-0.085650623885918
299,SARS2 aerosolizes over a dozen feet from patients,https://www.reddit.com/r/medicine/comments/g03jb8/sars2_aerosolizes_over_a_dozen_feet_from_patients/,Medical Studies,0.0,0.0
911,EPO v SARS CoV-2,https://www.reddit.com/r/medicine/comments/hcuw3p/epo_v_sars_cov2/,Healthcare System,-0.1511,0.08482142857142858
1144,Early Outpatient Treatment of COVID-19 Patients (Harvey A. Risch).,https://www.reddit.com/r/medicine/comments/i07065/early_outpatient_treatment_of_covid19_patients/,Medical Studies,0.0,0.1
107,BREAKING: S. Korea significantly reducing lethality of coronavirus by prescribing a chloroquine diphosphate salt + zinc treatment combo to block COVID-19 viral enzyme @ 500 mg per day of chloroquine + zinc for 10 days,https://www.reddit.com/r/medicine/comments/fhfxoe/breaking_s_korea_significantly_reducing_lethality/,Coronavirus Treatment,0.4404,0.5916666666666667
380,Swedish epidemiologist : why lockdowns are the wrong policy,https://www.reddit.com/r/medicine/comments/g3qgto/swedish_epidemiologist_why_lockdowns_are_the/,,-0.4767,-0.5
487,Wsj claims doctors are an overclass with little to risk in the covid epidemic,https://www.reddit.com/r/medicine/comments/gk2353/wsj_claims_doctors_are_an_overclass_with_little/,Medical Studies,0.4852,0.0628968253968254
1,"I posted a while back seeking a clinical portrait from those caring for COVID19 pts, and found a detailed one today from Evergreen. Please disseminate, esp to ICU/PACU/ED staff.",https://www.reddit.com/r/medicine/comments/figd1n/i_posted_a_while_back_seeking_a_clinical_portrait/,Healthcare System,-0.9888,0.007025394639031
55,Whats your unsual compliment form a patient story ?,https://www.reddit.com/r/medicine/comments/fce3rb/whats_your_unsual_compliment_form_a_patient_story/,Medical Studies,0.9183,0.26382716049382715
348,NP bill to allow independent practice in california passes assembly.,https://www.reddit.com/r/medicine/comments/evgypj/np_bill_to_allow_independent_practice_in/,,0.9033,0.0875
918,"Young female with hypertension, ectopic kidney, and persistent sinus tachycardia...",https://www.reddit.com/r/medicine/comments/hbvpec/young_female_with_hypertension_ectopic_kidney_and/,Healthcare System,0.5902,0.08399122807017544
85,Are medical errors really the third most common cause of death in the U.S.?,https://www.reddit.com/r/medicine/comments/ffthhd/are_medical_errors_really_the_third_most_common/,Coronavirus Precautions,-0.743,0.07999999999999999
754,Lancet articles regarding the Wuhan virus,https://www.reddit.com/r/medicine/comments/etl0z8/lancet_articles_regarding_the_wuhan_virus/,Coronavirus Treatment,0.0,0.0
384,Then there’s this garbage fire. Two docs from accelerated urgent care spouting lies about covid-19.,https://www.reddit.com/r/medicine/comments/g87swg/then_theres_this_garbage_fire_two_docs_from/,Medical Studies,-0.0516,0.0
241,Tired of talking about COVID? What other interesting patients and presentations have you had lately?,https://www.reddit.com/r/medicine/comments/fvl4fs/tired_of_talking_about_covid_what_other/,Coronavirus Treatment,0.755,0.01696428571428571
983,Masks with vent,https://www.reddit.com/r/medicine/comments/hptt6j/masks_with_vent/,Coronavirus Treatment,-0.5613,0.027083333333333334
907,"What is your facilitys current PPE policies for all, clinical providers, non-clinical staff, patients, and visitors?",https://www.reddit.com/r/medicine/comments/h9w2b2/what_is_your_facilitys_current_ppe_policies_for/,Coronavirus Treatment,0.0,0.2
274,How do you all fight the disinformation deluge?,https://www.reddit.com/r/medicine/comments/g15lkk/how_do_you_all_fight_the_disinformation_deluge/,Medical Studies,-0.6988,0.15784313725490198
1218,South Dakota bill would make trans health care for minors a felony,https://www.reddit.com/r/medicine/comments/euupcf/south_dakota_bill_would_make_trans_health_care/,School & Training,-0.0772,0.0
183,Remdesivir and chloroquine effectively inhibit the recently emerged novel coronavirus (2019-nCoV) in vitro.,https://www.reddit.com/r/medicine/comments/fjxeez/remdesivir_and_chloroquine_effectively_inhibit/,Coronavirus Treatment,0.3818,0.3
1243,"Meanwhile, in r/cancer, more nurse practitioner drama...",https://www.reddit.com/r/medicine/comments/f40z2l/meanwhile_in_rcancer_more_nurse_practitioner_drama/,Medical Studies,0.0,0.5
641,The Rogue Experimenters,https://www.reddit.com/r/medicine/comments/gnsvhn/the_rogue_experimenters/,Medical Studies,0.0,0.0
474,Ask Medicine: nurses who then graduated medical school: did any of you decide to go back to practicing nursing?,https://www.reddit.com/r/medicine/comments/gcnj7n/ask_medicine_nurses_who_then_graduated_medical/,Coronavirus Precautions,0.0,0.0
244,One Day of Care in New York,https://www.reddit.com/r/medicine/comments/g0ovry/one_day_of_care_in_new_york/,Medical Studies,0.9945,0.16716396771952327
964,Photophobia,https://www.reddit.com/r/medicine/comments/fbitno/photophobia/,Healthcare System,0.9126,0.140625
153,3 More Days of Inpatient Care in New York,https://www.reddit.com/r/medicine/comments/fqnqmb/3_more_days_of_inpatient_care_in_new_york/,Medical Studies,0.9981,0.08617415356947375
539,FM doc looking for reference book suggestion for fairly basic parenting questions about the first year or so of life.,https://www.reddit.com/r/medicine/comments/gerzzk/fm_doc_looking_for_reference_book_suggestion_for/,Medical Studies,-0.7545,-0.06035353535353536
346,"Keep insulting doctors, and good luck finding a physician in 10 years",https://www.reddit.com/r/medicine/comments/eqpdaf/keep_insulting_doctors_and_good_luck_finding_a/,Medical Studies,0.4019,-0.15000000000000002
932,Chair of Florida Resident Council Proposes Fundamental Issue Against APRN Independency,https://www.reddit.com/r/medicine/comments/fa414z/chair_of_florida_resident_council_proposes/,Medical Studies,0.0,0.0
333,Baffled at the confidence in analysis by people who have no experience nor formal education in the health care sector. Why is this so common in specifically health care?,https://www.reddit.com/r/medicine/comments/gap9ca/baffled_at_the_confidence_in_analysis_by_people/,,0.9583,0.013366402116402118
1075,Measuring Doctors by the Dollars They Generate is a Systemic Failure,https://www.reddit.com/r/medicine/comments/hsa317/measuring_doctors_by_the_dollars_they_generate_is/,Medical Studies,-0.5106,-0.3166666666666667
962,"suggestions about nipping ""odd affect"" in the bud?",https://www.reddit.com/r/medicine/comments/f9clyr/suggestions_about_nipping_odd_affect_in_the_bud/,Medical Studies,-0.8321,0.06645021645021645
1285,Petition against the proposed step 1 change,https://www.reddit.com/r/medicine/comments/f3bsv5/petition_against_the_proposed_step_1_change/,Coronavirus Precautions,0.0,0.0
786,"Suddenly, Public Health Officials Say Social Justice Matters More Than Social Distance",https://www.reddit.com/r/medicine/comments/gwv88v/suddenly_public_health_officials_say_social/,,0.5423,0.14166666666666666
527,The epitome of healthcare not taking care of their own,https://www.reddit.com/r/medicine/comments/ghx9fq/the_epitome_of_healthcare_not_taking_care_of/,Medical Studies,-0.6973,-0.002971514082625199
289,"The 1,000-Bed Comfort Was Supposed to Aid New York. It Has 20 Patients.",https://www.reddit.com/r/medicine/comments/ftzuks/the_1000bed_comfort_was_supposed_to_aid_new_york/,Medical Studies,0.3612,0.13636363636363635
1013,"Pediatricians: What are your favorite games, jokes, and tricks to play with your patients?",https://www.reddit.com/r/medicine/comments/hnlvuz/pediatricians_what_are_your_favorite_games_jokes/,Medical Studies,0.937,0.2791666666666667
1172,"A question for pediatricians and other professionals who are ""good with children"": how do you do it? What ""tricks"" do you use?",https://www.reddit.com/r/medicine/comments/f3nxfh/a_question_for_pediatricians_and_other/,Coronavirus Treatment,0.9176,0.35555555555555557
664,Impostor syndrome,https://www.reddit.com/r/medicine/comments/escbzw/impostor_syndrome/,Medical Studies,-0.7433,-0.027988365800865795
8,Walmart moves into healthcare in hopes of providing rural and underserved communities with primary care and other services. Honestly I trust them more than the slew of minute clinics and predatory free standing ERs in those areas.,https://www.reddit.com/r/medicine/comments/fcv988/walmart_moves_into_healthcare_in_hopes_of/,,0.9393,0.29583333333333334
1345,CA Governor wants physicians to prescribe houses,https://www.reddit.com/r/medicine/comments/f7hdk4/ca_governor_wants_physicians_to_prescribe_houses/,Coronavirus Precautions,0.0,0.2
255,Did we sign up to die? Looking at the role of the physician in society.,https://www.reddit.com/r/medicine/comments/fwioy2/did_we_sign_up_to_die_looking_at_the_role_of_the/,Coronavirus Precautions,-0.885,0.06999999999999999
285,PSA- Your co-workers can be a source for COVID exposure too,https://www.reddit.com/r/medicine/comments/g1ij4j/psa_your_coworkers_can_be_a_source_for_covid/,Medical Studies,0.9523,0.24083694083694088
11,The US has blown an opportunity to win back the public,https://www.reddit.com/r/medicine/comments/ffx7uv/the_us_has_blown_an_opportunity_to_win_back_the/,Medical Studies,0.9869,0.20129385964912277
568,It’s shocking that naturopaths are running around as pseudophysicians,https://www.reddit.com/r/medicine/comments/goox2k/its_shocking_that_naturopaths_are_running_around/,Coronavirus Precautions,-0.9056,-0.08676136363636365
889,"Racism, Hazing And Other Abuse Taints Medical Training, Students Say",https://www.reddit.com/r/medicine/comments/ha3wmy/racism_hazing_and_other_abuse_taints_medical/,Coronavirus Precautions,-0.8519,-0.0625
1026,"Low Value Care is everywhere - Oregon alone identified $530M spend on 3.8 million services--almost 40% of all commercial, medicaid, medicare in 2016-2018.",https://www.reddit.com/r/medicine/comments/hqlkqr/low_value_care_is_everywhere_oregon_alone/,,0.9571,0.11483870967741934
562,Anyone else feel the majority of your clinical time is on patients are those who don’t have “truly medical” issues?,https://www.reddit.com/r/medicine/comments/gqq4a8/anyone_else_feel_the_majority_of_your_clinical/,Medical Studies,0.9921,0.05961538461538461
651,"Physicians of Reddit, what are some uncommon things Nurses do that makes them stand out in a positive way?",https://www.reddit.com/r/medicine/comments/gzawha/physicians_of_reddit_what_are_some_uncommon/,Medical Studies,0.887,0.5318181818181819
98,Our COVID testing turnaround time is 6 days. What gives?,https://www.reddit.com/r/medicine/comments/fiwh55/our_covid_testing_turnaround_time_is_6_days_what/,Medical Studies,-0.834,0.049999999999999996
1105,is anyone else struggling with sleep?,https://www.reddit.com/r/medicine/comments/hs91wt/is_anyone_else_struggling_with_sleep/,Medical Studies,0.3086,0.14107142857142854
1246,How do doctors for national sports teams get those jobs? [serious],https://www.reddit.com/r/medicine/comments/f22txd/how_do_doctors_for_national_sports_teams_get/,Medical Studies,-0.3094,-0.3333333333333333
238,Terrified doctors risking their health fighting coronavirus dealt another blow -- pay cuts,https://www.reddit.com/r/medicine/comments/g0ldy5/terrified_doctors_risking_their_health_fighting/,,-0.886,0.0
311,"Attendings and residents, how is Covid-19 affecting your work nature/hours?",https://www.reddit.com/r/medicine/comments/fto4su/attendings_and_residents_how_is_covid19_affecting/,Medical Studies,0.6553,0.11214285714285714
1193,Any reason to use carotid US as part of ischemic stroke workup over CTA/MRA?,https://www.reddit.com/r/medicine/comments/eki2zc/any_reason_to_use_carotid_us_as_part_of_ischemic/,Healthcare System,-0.3736,0.06326530612244897
