,title,url,topic,compound_sentiment,textblob_polarity
297,COVID 19 experience/protocol creation,https://www.reddit.com/r/medicine/comments/fv687a/covid_19_experienceprotocol_creation/,Healthcare System,0.9697,0.08674446171206843
941,Relocating in the time of COVID-19,https://www.reddit.com/r/medicine/comments/hinq1h/relocating_in_the_time_of_covid19/,Medical Studies,0.9268,0.0875
1110,Effects of surgical and FFP2/N95 face masks on cardiopulmonary exercise capacity,https://www.reddit.com/r/medicine/comments/hv87e0/effects_of_surgical_and_ffp2n95_face_masks_on/,Medical Studies,0.0,0.0
503,A cause of high American drug costs?,https://www.reddit.com/r/medicine/comments/erf3mf/a_cause_of_high_american_drug_costs/,,0.9515,0.08334285714285712
1294,Are we tolerating the status quo too much? [Serious},https://www.reddit.com/r/medicine/comments/f4twlr/are_we_tolerating_the_status_quo_too_much_serious/,Coronavirus Precautions,-0.9944,-0.0007265313687332037
188,FDA issues emergency authorization of anti-malaria drug for coronavirus care,https://www.reddit.com/r/medicine/comments/frjprn/fda_issues_emergency_authorization_of_antimalaria/,Medical Studies,0.1531,0.0
87,Feedback on my idea to split ventilators safely to avoid barotrauma / volutrauma.,https://www.reddit.com/r/medicine/comments/fhaqk5/feedback_on_my_idea_to_split_ventilators_safely/,Medical Studies,0.25,0.5
226,Medical schools graduate M4s early with temporary licensing,https://www.reddit.com/r/medicine/comments/fqcvrz/medical_schools_graduate_m4s_early_with_temporary/,Coronavirus Precautions,0.0,0.05
1099,Is there any truth to this?,https://www.reddit.com/r/medicine/comments/huwdux/is_there_any_truth_to_this/,Medical Studies,0.3182,0.0
1287,Nurses to carry out surgery under NHS plans to slash waiting times,https://www.reddit.com/r/medicine/comments/f9cwcr/nurses_to_carry_out_surgery_under_nhs_plans_to/,Medical Studies,-0.2732,0.0
604,"Weekly Careers Thread: May 28, 2020",https://www.reddit.com/r/medicine/comments/gs4b73/weekly_careers_thread_may_28_2020/,Medical Studies,0.4588,0.4
1289,UCSF Addiction Psychiatry Bootcamp Lectures on Youtube,https://www.reddit.com/r/medicine/comments/excmqf/ucsf_addiction_psychiatry_bootcamp_lectures_on/,Coronavirus Precautions,0.4696,0.25
412,When will administrators cut their own salaries?,https://www.reddit.com/r/medicine/comments/g52uq1/when_will_administrators_cut_their_own_salaries/,Medical Studies,-0.1027,0.22000000000000003
100,The spread of antibiotic resistance is partly due to the ability of bacteria to pick up DNA from their surroundings. Study shows that drugs blocking this ability (which is called competence) in the bacterium S. pneumoniae can stop the spread of resistance in mice.,https://www.reddit.com/r/medicine/comments/fdjmtd/the_spread_of_antibiotic_resistance_is_partly_due/,,0.0323,-0.125
288,"Two independent studies confirm that the coronavirus in NY originated from Europe, not Asia",https://www.reddit.com/r/medicine/comments/fxkxkk/two_independent_studies_confirm_that_the/,Coronavirus Precautions,0.0,0.0
997,DAE?,https://www.reddit.com/r/medicine/comments/holvs1/dae/,Medical Studies,-0.6293,0.5
158,Oregon BON says nurses can’t refuse to see patients with no PPE. Invokes “social contract “,https://www.reddit.com/r/medicine/comments/fmrobi/oregon_bon_says_nurses_cant_refuse_to_see/,Coronavirus Treatment,-0.5267,0.03333333333333333
636,Daily glucose checks on T2 diabetes,https://www.reddit.com/r/medicine/comments/gqde4i/daily_glucose_checks_on_t2_diabetes/,Healthcare System,-0.6531,-0.010204081632653033
601,"Thoughts on NBOME (DO licensing board) continuing their in person PE starting July, even though the MD version (CS) was suspended for 12-18 months?",https://www.reddit.com/r/medicine/comments/gtadde/thoughts_on_nbome_do_licensing_board_continuing/,Coronavirus Precautions,-0.843,-0.05510752688172042
176,"Candid interview with Dr. Fauci, ""I mean, seriously, Jon, lets get real, what do you want me to do?""",https://www.reddit.com/r/medicine/comments/fnjiiu/candid_interview_with_dr_fauci_i_mean_seriously/,Medical Studies,-0.1027,0.03854166666666667
924,Miracles,https://www.reddit.com/r/medicine/comments/he21z5/miracles/,Coronavirus Precautions,0.0,0.0
108,Measuring blood pressure of anxious patients,https://www.reddit.com/r/medicine/comments/fd1a4s/measuring_blood_pressure_of_anxious_patients/,Medical Studies,0.6581,-0.005411764705882358
1062,Concerning scope of practice,https://www.reddit.com/r/medicine/comments/ev0vvu/concerning_scope_of_practice/,Coronavirus Precautions,0.7579,0.13712121212121214
518,Experienced ICU RN posts articulate and well-informed rebuttal video against COVID-19 misinformation. Thank you for being the voice of reason!,https://www.reddit.com/r/medicine/comments/gg7hgh/experienced_icu_rn_posts_articulate_and/,Medical Studies,0.126,1.0
509,"A little history for you - Antidote Chart, Canadian Pharmaceutical Association, 1957",https://www.reddit.com/r/medicine/comments/gh25l8/a_little_history_for_you_antidote_chart_canadian/,,0.0,-0.1875
317,"Private Practice, when will you start seeing patients again in person?",https://www.reddit.com/r/medicine/comments/g1ribp/private_practice_when_will_you_start_seeing/,Coronavirus Precautions,0.666,0.27901234567901234
260,An American MDs defense of Advanced Practice Providers (APPs),https://www.reddit.com/r/medicine/comments/g17vne/an_american_mds_defense_of_advanced_practice/,Coronavirus Precautions,0.994,0.051432273866484406
822,"How Rich Investors, Not Doctors, Profit From Marking Up ER Bills",https://www.reddit.com/r/medicine/comments/h7nxoh/how_rich_investors_not_doctors_profit_from/,,0.2946,0.375
627,Those in Primary Care clinics- Are you seeing pts with respiratory complaints?,https://www.reddit.com/r/medicine/comments/gty7mn/those_in_primary_care_clinics_are_you_seeing_pts/,Healthcare System,0.3527,0.2
844,July is coming - Scenarios for interns,https://www.reddit.com/r/medicine/comments/hf073x/july_is_coming_scenarios_for_interns/,Medical Studies,0.8321,0.1517406204906205
753,Executive Heart Screening Programs an Abuse of Testing - OPINION,https://www.reddit.com/r/medicine/comments/eswyyl/executive_heart_screening_programs_an_abuse_of/,Coronavirus Precautions,0.0,0.0
909,Prescribing for a First Aid Kit?,https://www.reddit.com/r/medicine/comments/hct1y3/prescribing_for_a_first_aid_kit/,,0.8385,0.2916666666666667
956,What was your biggest win?,https://www.reddit.com/r/medicine/comments/fa32is/what_was_your_biggest_win/,Medical Studies,0.5859,0.8
1045,A man was allegedly refused treatment due to disability in Texas Hospital. Thoughts?,https://www.reddit.com/r/medicine/comments/hlunxy/a_man_was_allegedly_refused_treatment_due_to/,Medical Studies,0.9621,-0.10171568627450979
1137,How do you keep up with the latest medical publications and practice guideline changes?,https://www.reddit.com/r/medicine/comments/hy7mdi/how_do_you_keep_up_with_the_latest_medical/,Coronavirus Treatment,0.6063,0.22000000000000003
987,What does C diff smell like?,https://www.reddit.com/r/medicine/comments/hno6xr/what_does_c_diff_smell_like/,Medical Studies,-0.0772,0.18888888888888888
464,"Finally able to speak to spokesman from UAPD (Physicians Union), heres what I found out",https://www.reddit.com/r/medicine/comments/ggemrk/finally_able_to_speak_to_spokesman_from_uapd/,,0.9967,0.08514786169244763
540,"""Safe"" mental health care",https://www.reddit.com/r/medicine/comments/gj988o/safe_mental_health_care/,Medical Studies,0.743,0.2
1070,Update: Journal of Vascular Surgery retracts recent social media professionalism article,https://www.reddit.com/r/medicine/comments/hxmuu2/update_journal_of_vascular_surgery_retracts/,,0.0,0.016666666666666666
418,Medical coding explained - a 5 minute guide,https://www.reddit.com/r/medicine/comments/g99zll/medical_coding_explained_a_5_minute_guide/,,0.9904,0.04511904761904763
883,Do you think there is/will be COVID-related PTSD in the general population?,https://www.reddit.com/r/medicine/comments/hain4l/do_you_think_there_iswill_be_covidrelated_ptsd_in/,Medical Studies,-0.7622,0.00833333333333334
1194,Mandated reporting,https://www.reddit.com/r/medicine/comments/eooi3l/mandated_reporting/,Coronavirus Precautions,-0.9631,-0.08787878787878788
323,I’ve read this three times today in the notes and it drives me mad.,https://www.reddit.com/r/medicine/comments/g33lll/ive_read_this_three_times_today_in_the_notes_and/,Medical Studies,-0.3612,-0.2125
392,"Weekly Careers Thread: April 30, 2020",https://www.reddit.com/r/medicine/comments/gatows/weekly_careers_thread_april_30_2020/,Medical Studies,0.4588,0.4
839,Dexamethasone shown to decrease COVID mortality,https://www.reddit.com/r/medicine/comments/ha3t2a/dexamethasone_shown_to_decrease_covid_mortality/,,0.0,0.0
835,Im sick of the fringe medicine,https://www.reddit.com/r/medicine/comments/hf2u4d/im_sick_of_the_fringe_medicine/,Medical Studies,-0.9591,-0.10182072829131651
171,Ohio Board of Pharmacy Emergency Rule for Dispensing Chloroquine and Hydroxychloroquine,https://www.reddit.com/r/medicine/comments/fo9c4i/ohio_board_of_pharmacy_emergency_rule_for/,Coronavirus Precautions,-0.3818,0.0
30,"With all this draft talk, how do you feel about this?",https://www.reddit.com/r/medicine/comments/ejlub5/with_all_this_draft_talk_how_do_you_feel_about/,Healthcare System,0.0,0.0
481,Overnight paging question from a new nurse,https://www.reddit.com/r/medicine/comments/gghvqp/overnight_paging_question_from_a_new_nurse/,Medical Studies,0.9645,0.06662403253312345
582,Could the isolation measures for COVID inadvertently halt the flu pandemic?,https://www.reddit.com/r/medicine/comments/gnwbgc/could_the_isolation_measures_for_covid/,Coronavirus Treatment,-0.8343,0.0
1064,"[Data Dashboard] United States spent $3.6 trillion on health care, the equivalent of $11,172 per person. An interactive dashboard of Oregon Hospital Payment Report shows where most money was going prior to COVID-19 pandemic.",https://www.reddit.com/r/medicine/comments/hwk2h4/data_dashboard_united_states_spent_36_trillion_on/,,0.9818,-0.01470588235294118
166,We have a 40M no pertinent PMH intubated in our ICU with COVID19. Is anyone else seeing younger people with no comorbidities having this clinical course?,https://www.reddit.com/r/medicine/comments/fk78ms/we_have_a_40m_no_pertinent_pmh_intubated_in_our/,Medical Studies,-0.4515,0.1388888888888889
1230,Apparently the word “science” is virtue signaling. NYTimes publishes pro-Goop op ed,https://www.reddit.com/r/medicine/comments/ey6f4m/apparently_the_word_science_is_virtue_signaling/,,0.7745,-0.024999999999999977
360,Chinese doctor in the city of Wuhan in tears announcing that there are too many cases of sick people,https://www.reddit.com/r/medicine/comments/etait2/chinese_doctor_in_the_city_of_wuhan_in_tears/,Medical Studies,-0.6369,-0.07142857142857144
511,2 MD couples in quarantine,https://www.reddit.com/r/medicine/comments/gcl14d/2_md_couples_in_quarantine/,Coronavirus Treatment,0.9529,0.15126262626262627
801,Do you think there will be use of body cams on physicians to document encounters?,https://www.reddit.com/r/medicine/comments/gvgizk/do_you_think_there_will_be_use_of_body_cams_on/,Coronavirus Treatment,-0.1154,0.06000000000000001
629,Why direct primary care is thriving in COVID-19,https://www.reddit.com/r/medicine/comments/go22i4/why_direct_primary_care_is_thriving_in_covid19/,,0.9546,0.23846153846153847
1066,Hospitals Overbilled Medicare $1 Billion By Incorrectly Assigning Severe Malnutrition Diagnosis Codes To Inpatient Hospital Claims,https://www.reddit.com/r/medicine/comments/hw2v33/hospitals_overbilled_medicare_1_billion_by/,Medical Studies,-0.3818,0.0
561,Organ Donation in England is now opt out!,https://www.reddit.com/r/medicine/comments/gngd6t/organ_donation_in_england_is_now_opt_out/,Medical Studies,-0.4102,0.375
842,American Medical Associations new president a passionate defender of the independent physician,https://www.reddit.com/r/medicine/comments/hbf5y9/american_medical_associations_new_president_a/,Coronavirus Precautions,0.5859,0.01727272727272727
802,Question about discharging a Pt from My Practice,https://www.reddit.com/r/medicine/comments/h96f9q/question_about_discharging_a_pt_from_my_practice/,Coronavirus Precautions,0.5106,0.10606060606060606
810,NYTs report on impact of retracted scientific articles,https://www.reddit.com/r/medicine/comments/h9edw0/nyts_report_on_impact_of_retracted_scientific/,Coronavirus Precautions,0.0,0.0
465,What do Physicians/NPs want?,https://www.reddit.com/r/medicine/comments/gjcqaf/what_do_physiciansnps_want/,Coronavirus Precautions,-0.8928,0.06331453634085213
671,From Florida Medical Association.,https://www.reddit.com/r/medicine/comments/epc93c/from_florida_medical_association/,Coronavirus Precautions,0.9752,0.010824242424242424
598,"Which single antibiotic would you take with you, if there was a global natural disaster and you were one of the few survivors - and why?",https://www.reddit.com/r/medicine/comments/gkuws4/which_single_antibiotic_would_you_take_with_you/,Medical Studies,0.8943,0.1400297619047619
1242,Mayo Clinic Medical School accidentally sends acceptance emails to all applicants,https://www.reddit.com/r/medicine/comments/f3yr1u/mayo_clinic_medical_school_accidentally_sends/,Coronavirus Precautions,0.1531,0.0
897,Help with setting up a visiting virtual medical student rotation.,https://www.reddit.com/r/medicine/comments/h9uwwc/help_with_setting_up_a_visiting_virtual_medical/,Coronavirus Precautions,0.9153,0.16818181818181818
680,Self wound closure,https://www.reddit.com/r/medicine/comments/en1ru0/self_wound_closure/,Medical Studies,0.1027,0.023958333333333335
565,Forbes: 600 Physicians Say Lockdowns Are A ‘Mass Casualty Incident’,https://www.reddit.com/r/medicine/comments/gr413i/forbes_600_physicians_say_lockdowns_are_a_mass/,Coronavirus Treatment,-0.9552,-0.0035714285714285704
1080,JAMA letter regarding Dr. Fauci,https://www.reddit.com/r/medicine/comments/hsihnn/jama_letter_regarding_dr_fauci/,,0.0,0.0
865,Patients being able to direct message and self schedule within MyChart is the worst.,https://www.reddit.com/r/medicine/comments/hf1i32/patients_being_able_to_direct_message_and_self/,Medical Studies,-0.7184,0.04285714285714286
797,Syncope during surgery,https://www.reddit.com/r/medicine/comments/gv6v5r/syncope_during_surgery/,Medical Studies,-0.4836,-0.023048941798941805
1220,Resilience building alone is not enough,https://www.reddit.com/r/medicine/comments/esbysx/resilience_building_alone_is_not_enough/,Medical Studies,-0.25,0.0
292,Are scarves an acceptable substitute to medical-grade face masks? - A microscopic journey!,https://www.reddit.com/r/medicine/comments/funmc5/are_scarves_an_acceptable_substitute_to/,Coronavirus Treatment,0.3802,0.0
731,How to not awkwardly forget you’ve seen a patient’s family member...,https://www.reddit.com/r/medicine/comments/epby2u/how_to_not_awkwardly_forget_youve_seen_a_patients/,Medical Studies,-0.4438,0.01666666666666667
800,Explaining somataform disorders to patients,https://www.reddit.com/r/medicine/comments/h0pbdw/explaining_somataform_disorders_to_patients/,Medical Studies,0.802,0.15
961,Is there evidence to use Zofran ODT sublingual?,https://www.reddit.com/r/medicine/comments/f9jpgw/is_there_evidence_to_use_zofran_odt_sublingual/,School & Training,0.8614,0.19999999999999998
790,Why are medical experts called physicians?,https://www.reddit.com/r/medicine/comments/h8bug3/why_are_medical_experts_called_physicians/,Coronavirus Precautions,0.0,0.0
308,"COVID-19, pulmonary hypertension, right heart failure and sickle cell anemia",https://www.reddit.com/r/medicine/comments/fzvqqc/covid19_pulmonary_hypertension_right_heart/,Coronavirus Treatment,0.9924,0.08959573412698411
548,Inside the NIH’s controversial decision to stop its big remdesivir study,https://www.reddit.com/r/medicine/comments/gi25fl/inside_the_nihs_controversial_decision_to_stop/,,-0.4588,0.275
1309,How many doctors does it take to do an MRI? /s,https://www.reddit.com/r/medicine/comments/f62xwv/how_many_doctors_does_it_take_to_do_an_mri_s/,Medical Studies,0.168,-0.02095959595959597
416,Your opinion on Liraglutide/Phentermine + Topiramate,https://www.reddit.com/r/medicine/comments/g3p1e0/your_opinion_on_liraglutidephentermine_topiramate/,School & Training,0.8387,0.02361111111111112
923,New Eye Drops May Prevent a Common Cause of Blindness,https://www.reddit.com/r/medicine/comments/hi3spg/new_eye_drops_may_prevent_a_common_cause_of/,Medical Studies,0.0258,-0.08181818181818182
35,French doctors striking,https://www.reddit.com/r/medicine/comments/emqm7z/french_doctors_striking/,Medical Studies,0.0,0.25
645,About comparative studies,https://www.reddit.com/r/medicine/comments/gr9z5f/about_comparative_studies/,Coronavirus Precautions,0.1531,0.4
647,Covid-19 has exposed the limits of todays drug development model,https://www.reddit.com/r/medicine/comments/gnayq3/covid19_has_exposed_the_limits_of_todays_drug/,Coronavirus Precautions,-0.0772,0.0
589,The rationale for switching Step 1 from a score to pass/fail,https://www.reddit.com/r/medicine/comments/gu7ily/the_rationale_for_switching_step_1_from_a_score/,Coronavirus Precautions,0.0,0.0
1087,White House blocks CDC from testifying on reopening schools next week,https://www.reddit.com/r/medicine/comments/ht7brf/white_house_blocks_cdc_from_testifying_on/,Medical Studies,-0.2263,0.0
44,Night Shift Physicians,https://www.reddit.com/r/medicine/comments/envrij/night_shift_physicians/,Coronavirus Treatment,0.1655,0.0
536,Fecal oral route for COVID-19 infection. Maybe we should be doing rectal swabs? (crosspost),https://www.reddit.com/r/medicine/comments/ggdhqq/fecal_oral_route_for_covid19_infection_maybe_we/,Coronavirus Treatment,0.0,0.0
1319,California orthopedic surgeon killed by patient in exam room,https://www.reddit.com/r/medicine/comments/f4m494/california_orthopedic_surgeon_killed_by_patient/,Medical Studies,-0.6124,-0.07500000000000001
1305,"New study shows that nearly half of trans kids have avoided disclosing their gender identity to a doctor, even through they felt it was medically important",https://www.reddit.com/r/medicine/comments/f6vis7/new_study_shows_that_nearly_half_of_trans_kids/,Medical Studies,-0.1531,0.12323232323232325
879,Our Ideas about Obesity may be Completely Wrong,https://www.reddit.com/r/medicine/comments/hdaq2i/our_ideas_about_obesity_may_be_completely_wrong/,Medical Studies,-0.5256,-0.5
65,Digital degradation,https://www.reddit.com/r/medicine/comments/f04ckn/digital_degradation/,,0.992,0.08513257575757577
1170,Would this work?,https://www.reddit.com/r/medicine/comments/ewxmfr/would_this_work/,Medical Studies,0.0,0.0
554,Female physicians: Did you take your husband’s surname or keep your maiden name?,https://www.reddit.com/r/medicine/comments/gru71g/female_physicians_did_you_take_your_husbands/,Medical Studies,0.4116,0.1
969,I quit my job yesterday,https://www.reddit.com/r/medicine/comments/hkordv/i_quit_my_job_yesterday/,Medical Studies,-0.9542,-0.04574314574314574
22,I would like to vent and share my first experience with a medical error,https://www.reddit.com/r/medicine/comments/fevp4g/i_would_like_to_vent_and_share_my_first/,Medical Studies,-0.9244,0.02660153118486452
133,Mass casualty triage for covid,https://www.reddit.com/r/medicine/comments/fgs4sw/mass_casualty_triage_for_covid/,Coronavirus Treatment,-0.2305,0.17145833333333335
524,Any advice for purchasing an industrial respirator for use in the hospital?,https://www.reddit.com/r/medicine/comments/giqqia/any_advice_for_purchasing_an_industrial/,Coronavirus Treatment,0.8796,0.15000000000000002
1332,Atrium Health CEO defends security guards brutalizing teenager on camera,https://www.reddit.com/r/medicine/comments/f647xp/atrium_health_ceo_defends_security_guards/,,-0.4588,0.0
142,"Dr. Usama Riaz has spent weeks screening, treating coronavirus patients even then he knew PPE was not available. He lost his battle today. Remember his name. He was 26.",https://www.reddit.com/r/medicine/comments/fnz2a3/dr_usama_riaz_has_spent_weeks_screening_treating/,Medical Studies,-0.1625,-0.15000000000000002
1307,"Article published in the Lancet: $450b, 68,000 lives, and 1.73 million life-years saved with a single payer healthcare system.",https://www.reddit.com/r/medicine/comments/f4djns/article_published_in_the_lancet_450b_68000_lives/,,0.4215,-0.07142857142857142
1159,Marik protocol shows no benefit in survival or pressor use in first large RCT,https://www.reddit.com/r/medicine/comments/eq9bhp/marik_protocol_shows_no_benefit_in_survival_or/,Coronavirus Treatment,-0.357,0.23214285714285715
1290,Why is Scoliosis Incurable?,https://www.reddit.com/r/medicine/comments/f24nm4/why_is_scoliosis_incurable/,Medical Studies,-0.5803,-0.02559523809523809
573,Fed is Combining Viral Tests with Antibody Tests: ‘How Could the CDC Make That Mistake?’,https://www.reddit.com/r/medicine/comments/gp2geg/fed_is_combining_viral_tests_with_antibody_tests/,School & Training,0.0,0.0
1034,Resident contemplating SSRI initiation- leave of abscence required?,https://www.reddit.com/r/medicine/comments/hrodax/resident_contemplating_ssri_initiation_leave_of/,Medical Studies,0.8875,-0.10777777777777779
1226,You Died by Suicide,https://www.reddit.com/r/medicine/comments/ewo32r/you_died_by_suicide/,Medical Studies,-0.8442,0.0
1340,Evelyn Yangs OB-GYN took advantage of her and his other patients during routine physical exams. One patient even claimed he licked her v*gina during exam.,https://www.reddit.com/r/medicine/comments/f8tqol/evelyn_yangs_obgyn_took_advantage_of_her_and_his/,Medical Studies,0.25,-0.0625
898,"CDC: “In the 10 weeks following declaration of the COVID-19 national emergency, ED visits declined 23% for heart attack, 20% for stroke, and 10% for hyperglycemic crisis”",https://www.reddit.com/r/medicine/comments/hedmsx/cdc_in_the_10_weeks_following_declaration_of_the/,Medical Studies,-0.128,0.0
1265,"(UK) GP convicted for sexual assualt during examinations, commenter asks if women should trust their doctor",https://www.reddit.com/r/medicine/comments/f17jzz/uk_gp_convicted_for_sexual_assualt_during/,School & Training,0.5106,0.5
1079,NYT Poll finds 59% of Americans always wear masks when out when expecting to be within 6 feet of another person.,https://www.reddit.com/r/medicine/comments/hurhtz/nyt_poll_finds_59_of_americans_always_wear_masks/,,0.0,0.0
78,"On the bright/ worse side, less people seem to be coming to the hospital.",https://www.reddit.com/r/medicine/comments/fjbm4k/on_the_bright_worse_side_less_people_seem_to_be/,Medical Studies,0.9012,0.1143939393939394
861,CanSinos COVID-19 vaccine candidate approved for military use in China,https://www.reddit.com/r/medicine/comments/hifky5/cansinos_covid19_vaccine_candidate_approved_for/,Coronavirus Treatment,0.4215,-0.1
149,"Please, stop prescribing hydroxychloroquine for yourselves and your family right now.",https://www.reddit.com/r/medicine/comments/flor5z/please_stop_prescribing_hydroxychloroquine_for/,Coronavirus Precautions,0.6055,0.07044642857142855
331,"Is anybodys hospital rolling out ""Back to normal"" steps? Im worried about the stroke and MI patients that arent coming to the ED.",https://www.reddit.com/r/medicine/comments/g2n613/is_anybodys_hospital_rolling_out_back_to_normal/,Medical Studies,0.842,0.1517526455026455
121,What guidelines are part of EDC?,https://www.reddit.com/r/medicine/comments/f2ut4t/what_guidelines_are_part_of_edc/,Coronavirus Treatment,0.6958,0.1875
595,how do you personally work towards social justice in medicine?,https://www.reddit.com/r/medicine/comments/gsrq82/how_do_you_personally_work_towards_social_justice/,Medical Studies,0.9694,0.1933333333333333
794,Questions about Private Practices,https://www.reddit.com/r/medicine/comments/guc9tk/questions_about_private_practices/,Medical Studies,-0.8677,0.08958333333333333
357,Do rules of corporate America apply to medicine too ?,https://www.reddit.com/r/medicine/comments/erh1ar/do_rules_of_corporate_america_apply_to_medicine/,Medical Studies,0.9508,0.06514636157493299
83,Concerns About Future in Medicine (This Subreddit Got Me Tripping),https://www.reddit.com/r/medicine/comments/ff86ca/concerns_about_future_in_medicine_this_subreddit/,Coronavirus Precautions,0.977,0.048790445665445686
494,"Strike by Seattle Nurses, Staff Closes Emergency Rooms",https://www.reddit.com/r/medicine/comments/evrwmw/strike_by_seattle_nurses_staff_closes_emergency/,Medical Studies,-0.4767,0.0
685,Is burnout as we know it a US medicine phenomenon?,https://www.reddit.com/r/medicine/comments/ekhslj/is_burnout_as_we_know_it_a_us_medicine_phenomenon/,Medical Studies,-0.392,0.06340659340659341
892,This article with a real case scenario highlights the limitations of human cognition in todays world of medical practice where doctors have to evaluate hundreds patients by just a few minutes on each of them. Could you share articles like this that give interesting insights into medicine?,https://www.reddit.com/r/medicine/comments/hawzgq/this_article_with_a_real_case_scenario_highlights/,Medical Studies,0.7506,0.1
499,Physicians are paid 7.3% of our total National Health Expenditure,https://www.reddit.com/r/medicine/comments/esjght/physicians_are_paid_73_of_our_total_national/,Medical Studies,0.0,0.0
1189,Choosing cost of living/work hours balance?,https://www.reddit.com/r/medicine/comments/epib0p/choosing_cost_of_livingwork_hours_balance/,Medical Studies,-0.2551,0.12043290043290042
232,Does Cuomo think we (doctors) will all volunteer?,https://www.reddit.com/r/medicine/comments/g18f4j/does_cuomo_think_we_doctors_will_all_volunteer/,Medical Studies,-0.1078,0.22777777777777777
